{
  "schema_version": "1.0.0",
  "id": "scenario-001",
  "title": "本地优先设计讨论",
  "summary": "用户确认当前项目必须先保存原档，再生成可追溯记忆。",
  "atom_ids": [
    "atom-001"
  ],
  "source_refs": [
    {
      "source_id": "source-text-001",
      "locator": "char:0-60"
    }
  ],
  "tags": [
    "memory",
    "local-first"
  ],
  "series_id": "series-default",
  "project_id": null,
  "stale": false,
  "stale_reason": null,
  "revision": 1,
  "created_at": "2026-06-29T12:10:00+08:00",
  "updated_at": "2026-06-29T12:10:00+08:00",
  "trust_status": "system_generated"
}
